{
  "schema_version": "0.3.0-draft",
  "artifact_kind": "runtime",
  "source_elements_schema_version": "1.1.0",
  "page_url": "https://demo.easyview.local/gov/",
  "final_url": "snapshot://gov",
  "page_title": "市政务服务中心 · 办事大厅（本地快照）",
  "source": "fallback",
  "generated_at": "2026-10-02T12:00:00+08:00",
  "input_snapshot": {
    "sha256": "c3e8fbfd7c7995a94512a80b4f3880dd0724a6bff2875a8c3bda4b0ec76695bf",
    "extracted_at": "2026-10-02T12:37:05+08:00"
  },
  "generator": {
    "mode": "rules",
    "policy_version": "senior-v0.3",
    "prompt_version": null,
    "fallback_reason": null
  },
  "user_goal": null,
  "state": "ready",
  "empty_reason": null,
  "page": {
    "greeting": "您好，这里是市政务服务中心 办事大厅（本地快照）",
    "summary": "这里可以查办事指南、查社保医保、办医保和查公积金"
  },
  "stats": {
    "input_elements": 80,
    "visible_elements": 80,
    "input_truncated": false,
    "referenced_elements": 6,
    "task_cards": 6
  },
  "cards": [
    {
      "id": "card_01",
      "title": "查办事指南",
      "subtitle": null,
      "icon": "search",
      "priority": 1,
      "intent": "query",
      "provenance": {
        "source_element_ids": [
          "el_c86b7096"
        ],
        "evidence": [
          {
            "id": "ev_1",
            "element_id": "el_c86b7096",
            "field": "text",
            "quote": "事项名称关键字 办理区域 全部区域 示例区 演示区 测试区 事项类型 个人事项 法人事项 查询办事指南"
          }
        ]
      },
      "content_meta": {
        "title": {
          "mode": "rewritten",
          "evidence_ids": [
            "ev_1"
          ]
        },
        "subtitle": null
      },
      "facts": [],
      "ranking": {
        "reason_codes": [
          "main_service"
        ],
        "explanation": "规则引擎按关键词表选出",
        "evidence_ids": [
          "ev_1"
        ]
      },
      "risk": {
        "level": "normal",
        "domains": [],
        "reason_codes": [
          "read_only"
        ],
        "evidence_ids": [
          "ev_1"
        ]
      },
      "action": {
        "target_element_id": "el_c86b7096",
        "target_selector": "div:nth-of-type(3) > div > form",
        "target_xpath": "/html[1]/body[1]/div[4]/div[1]/div[3]/div[1]/form[1]",
        "kind": "form",
        "href": null,
        "confirmation": null
      }
    },
    {
      "id": "card_02",
      "title": "查社保医保",
      "subtitle": "社保医保",
      "icon": "government",
      "priority": 2,
      "intent": "query",
      "provenance": {
        "source_element_ids": [
          "el_f31a6d95"
        ],
        "evidence": [
          {
            "id": "ev_1",
            "element_id": "el_f31a6d95",
            "field": "text",
            "quote": "社保医保"
          }
        ]
      },
      "content_meta": {
        "title": {
          "mode": "rewritten",
          "evidence_ids": [
            "ev_1"
          ]
        },
        "subtitle": {
          "mode": "rewritten",
          "evidence_ids": [
            "ev_1"
          ]
        }
      },
      "facts": [],
      "ranking": {
        "reason_codes": [
          "main_service"
        ],
        "explanation": "规则引擎按关键词表选出",
        "evidence_ids": [
          "ev_1"
        ]
      },
      "risk": {
        "level": "sensitive",
        "domains": [
          "healthcare"
        ],
        "reason_codes": [
          "personal_data"
        ],
        "evidence_ids": [
          "ev_1"
        ]
      },
      "action": {
        "target_element_id": "el_f31a6d95",
        "target_selector": "nav > a:nth-of-type(3)",
        "target_xpath": "/html[1]/body[1]/nav[1]/a[3]",
        "kind": "navigate",
        "href": "https://demo.easyview.local/bsfw/sb",
        "confirmation": {
          "message": "这会打开需要核对个人信息的页面，请注意保护您的资料。",
          "confirm_label": "继续",
          "cancel_label": "先不打开"
        }
      }
    },
    {
      "id": "card_03",
      "title": "办医保",
      "subtitle": "医保参保登记",
      "icon": "government",
      "priority": 3,
      "intent": "learn",
      "provenance": {
        "source_element_ids": [
          "el_59c31598"
        ],
        "evidence": [
          {
            "id": "ev_1",
            "element_id": "el_59c31598",
            "field": "text",
            "quote": "医保参保登记"
          }
        ]
      },
      "content_meta": {
        "title": {
          "mode": "rewritten",
          "evidence_ids": [
            "ev_1"
          ]
        },
        "subtitle": {
          "mode": "rewritten",
          "evidence_ids": [
            "ev_1"
          ]
        }
      },
      "facts": [],
      "ranking": {
        "reason_codes": [
          "main_service"
        ],
        "explanation": "规则引擎按关键词表选出",
        "evidence_ids": [
          "ev_1"
        ]
      },
      "risk": {
        "level": "sensitive",
        "domains": [
          "healthcare"
        ],
        "reason_codes": [
          "personal_data"
        ],
        "evidence_ids": [
          "ev_1"
        ]
      },
      "action": {
        "target_element_id": "el_59c31598",
        "target_selector": "div:nth-of-type(2) > div > a:nth-of-type(1)",
        "target_xpath": "/html[1]/body[1]/div[4]/div[1]/div[2]/div[1]/a[1]",
        "kind": "navigate",
        "href": "https://demo.easyview.local/item/yb",
        "confirmation": {
          "message": "这会打开需要核对个人信息的页面，请注意保护您的资料。",
          "confirm_label": "继续",
          "cancel_label": "先不打开"
        }
      }
    },
    {
      "id": "card_04",
      "title": "查公积金",
      "subtitle": "公积金查询",
      "icon": "search",
      "priority": 4,
      "intent": "query",
      "provenance": {
        "source_element_ids": [
          "el_13e36134"
        ],
        "evidence": [
          {
            "id": "ev_1",
            "element_id": "el_13e36134",
            "field": "text",
            "quote": "公积金查询"
          }
        ]
      },
      "content_meta": {
        "title": {
          "mode": "rewritten",
          "evidence_ids": [
            "ev_1"
          ]
        },
        "subtitle": {
          "mode": "rewritten",
          "evidence_ids": [
            "ev_1"
          ]
        }
      },
      "facts": [],
      "ranking": {
        "reason_codes": [
          "main_service"
        ],
        "explanation": "规则引擎按关键词表选出",
        "evidence_ids": [
          "ev_1"
        ]
      },
      "risk": {
        "level": "sensitive",
        "domains": [],
        "reason_codes": [
          "personal_data"
        ],
        "evidence_ids": [
          "ev_1"
        ]
      },
      "action": {
        "target_element_id": "el_13e36134",
        "target_selector": "div:nth-of-type(2) > div > a:nth-of-type(2)",
        "target_xpath": "/html[1]/body[1]/div[4]/div[1]/div[2]/div[1]/a[2]",
        "kind": "navigate",
        "href": "https://demo.easyview.local/item/gjj",
        "confirmation": {
          "message": "这会打开需要核对个人信息的页面，请注意保护您的资料。",
          "confirm_label": "继续",
          "cancel_label": "先不打开"
        }
      }
    },
    {
      "id": "card_05",
      "title": "开户籍证明",
      "subtitle": "户籍证明开具",
      "icon": "government",
      "priority": 5,
      "intent": "learn",
      "provenance": {
        "source_element_ids": [
          "el_dee69604"
        ],
        "evidence": [
          {
            "id": "ev_1",
            "element_id": "el_dee69604",
            "field": "text",
            "quote": "户籍证明开具"
          }
        ]
      },
      "content_meta": {
        "title": {
          "mode": "rewritten",
          "evidence_ids": [
            "ev_1"
          ]
        },
        "subtitle": {
          "mode": "rewritten",
          "evidence_ids": [
            "ev_1"
          ]
        }
      },
      "facts": [],
      "ranking": {
        "reason_codes": [
          "main_service"
        ],
        "explanation": "规则引擎按关键词表选出",
        "evidence_ids": [
          "ev_1"
        ]
      },
      "risk": {
        "level": "normal",
        "domains": [],
        "reason_codes": [
          "read_only"
        ],
        "evidence_ids": [
          "ev_1"
        ]
      },
      "action": {
        "target_element_id": "el_dee69604",
        "target_selector": "div:nth-of-type(2) > div > a:nth-of-type(3)",
        "target_xpath": "/html[1]/body[1]/div[4]/div[1]/div[2]/div[1]/a[3]",
        "kind": "navigate",
        "href": "https://demo.easyview.local/item/hj",
        "confirmation": null
      }
    },
    {
      "id": "card_06",
      "title": "查社保缴费",
      "subtitle": "社保缴费记录",
      "icon": "payment",
      "priority": 6,
      "intent": "pay",
      "provenance": {
        "source_element_ids": [
          "el_5973edb5"
        ],
        "evidence": [
          {
            "id": "ev_1",
            "element_id": "el_5973edb5",
            "field": "text",
            "quote": "社保缴费记录"
          }
        ]
      },
      "content_meta": {
        "title": {
          "mode": "rewritten",
          "evidence_ids": [
            "ev_1"
          ]
        },
        "subtitle": {
          "mode": "rewritten",
          "evidence_ids": [
            "ev_1"
          ]
        }
      },
      "facts": [],
      "ranking": {
        "reason_codes": [
          "main_service"
        ],
        "explanation": "规则引擎按关键词表选出",
        "evidence_ids": [
          "ev_1"
        ]
      },
      "risk": {
        "level": "blocked",
        "domains": [
          "money"
        ],
        "reason_codes": [
          "payment"
        ],
        "evidence_ids": [
          "ev_1"
        ]
      },
      "action": {
        "target_element_id": "el_5973edb5",
        "target_selector": "div:nth-of-type(2) > div > a:nth-of-type(4)",
        "target_xpath": "/html[1]/body[1]/div[4]/div[1]/div[2]/div[1]/a[4]",
        "kind": "navigate",
        "href": "https://demo.easyview.local/item/shebao",
        "confirmation": null
      }
    }
  ]
}