{
  "schema_version": "0.3.0-draft",
  "artifact_kind": "runtime",
  "source_elements_schema_version": "1.1.0",
  "page_url": "https://demo.easyview.local/traffic/",
  "final_url": "snapshot://traffic",
  "page_title": "市交通运输局 · 出行服务（本地快照）",
  "source": "fallback",
  "generated_at": "2026-10-02T12:00:00+08:00",
  "input_snapshot": {
    "sha256": "e5103af4eee41c3fe3531a785d7bf8a8bafa9afd8ed26d3fc97fc677eba7109f",
    "extracted_at": "2026-10-02T12:37:06+08:00"
  },
  "generator": {
    "mode": "rules",
    "policy_version": "senior-v0.3",
    "prompt_version": null,
    "fallback_reason": null
  },
  "user_goal": null,
  "state": "ready",
  "empty_reason": null,
  "page": {
    "greeting": "您好，这里是市交通运输局 出行服务（本地快照）",
    "summary": "这里可以查违章、办证件、查公交和坐地铁"
  },
  "stats": {
    "input_elements": 81,
    "visible_elements": 81,
    "input_truncated": false,
    "referenced_elements": 6,
    "task_cards": 6
  },
  "cards": [
    {
      "id": "card_01",
      "title": "查违章",
      "subtitle": null,
      "icon": "search",
      "priority": 1,
      "intent": "query",
      "provenance": {
        "source_element_ids": [
          "el_d8f955e1"
        ],
        "evidence": [
          {
            "id": "ev_1",
            "element_id": "el_d8f955e1",
            "field": "text",
            "quote": "车牌号码 车架号后六位 车辆类型 小型汽车 大型汽车 摩托车 查询违章记录"
          }
        ]
      },
      "content_meta": {
        "title": {
          "mode": "rewritten",
          "evidence_ids": [
            "ev_1"
          ]
        },
        "subtitle": null
      },
      "facts": [],
      "ranking": {
        "reason_codes": [
          "main_service"
        ],
        "explanation": "规则引擎按关键词表选出",
        "evidence_ids": [
          "ev_1"
        ]
      },
      "risk": {
        "level": "normal",
        "domains": [],
        "reason_codes": [
          "read_only"
        ],
        "evidence_ids": [
          "ev_1"
        ]
      },
      "action": {
        "target_element_id": "el_d8f955e1",
        "target_selector": "div:nth-of-type(2) > div > form",
        "target_xpath": "/html[1]/body[1]/div[3]/div[1]/div[2]/div[1]/form[1]",
        "kind": "form",
        "href": null,
        "confirmation": null
      }
    },
    {
      "id": "card_02",
      "title": "办证件",
      "subtitle": "证照办理",
      "icon": "info",
      "priority": 2,
      "intent": "learn",
      "provenance": {
        "source_element_ids": [
          "el_c8dc41cb"
        ],
        "evidence": [
          {
            "id": "ev_1",
            "element_id": "el_c8dc41cb",
            "field": "text",
            "quote": "证照办理"
          }
        ]
      },
      "content_meta": {
        "title": {
          "mode": "rewritten",
          "evidence_ids": [
            "ev_1"
          ]
        },
        "subtitle": {
          "mode": "rewritten",
          "evidence_ids": [
            "ev_1"
          ]
        }
      },
      "facts": [],
      "ranking": {
        "reason_codes": [
          "main_service"
        ],
        "explanation": "规则引擎按关键词表选出",
        "evidence_ids": [
          "ev_1"
        ]
      },
      "risk": {
        "level": "normal",
        "domains": [],
        "reason_codes": [
          "read_only"
        ],
        "evidence_ids": [
          "ev_1"
        ]
      },
      "action": {
        "target_element_id": "el_c8dc41cb",
        "target_selector": "nav > a:nth-of-type(7)",
        "target_xpath": "/html[1]/body[1]/nav[1]/a[7]",
        "kind": "navigate",
        "href": "https://demo.easyview.local/license",
        "confirmation": null
      }
    },
    {
      "id": "card_03",
      "title": "查公交",
      "subtitle": "公交查询",
      "icon": "bus",
      "priority": 3,
      "intent": "query",
      "provenance": {
        "source_element_ids": [
          "el_1c7ec156"
        ],
        "evidence": [
          {
            "id": "ev_1",
            "element_id": "el_1c7ec156",
            "field": "text",
            "quote": "公交查询"
          }
        ]
      },
      "content_meta": {
        "title": {
          "mode": "rewritten",
          "evidence_ids": [
            "ev_1"
          ]
        },
        "subtitle": {
          "mode": "rewritten",
          "evidence_ids": [
            "ev_1"
          ]
        }
      },
      "facts": [],
      "ranking": {
        "reason_codes": [
          "main_service"
        ],
        "explanation": "规则引擎按关键词表选出",
        "evidence_ids": [
          "ev_1"
        ]
      },
      "risk": {
        "level": "normal",
        "domains": [],
        "reason_codes": [
          "read_only"
        ],
        "evidence_ids": [
          "ev_1"
        ]
      },
      "action": {
        "target_element_id": "el_1c7ec156",
        "target_selector": "nav > a:nth-of-type(1)",
        "target_xpath": "/html[1]/body[1]/nav[1]/a[1]",
        "kind": "navigate",
        "href": "https://demo.easyview.local/bus",
        "confirmation": null
      }
    },
    {
      "id": "card_04",
      "title": "坐地铁",
      "subtitle": "地铁出行",
      "icon": "info",
      "priority": 4,
      "intent": "learn",
      "provenance": {
        "source_element_ids": [
          "el_e64c55d5"
        ],
        "evidence": [
          {
            "id": "ev_1",
            "element_id": "el_e64c55d5",
            "field": "text",
            "quote": "地铁出行"
          }
        ]
      },
      "content_meta": {
        "title": {
          "mode": "rewritten",
          "evidence_ids": [
            "ev_1"
          ]
        },
        "subtitle": {
          "mode": "rewritten",
          "evidence_ids": [
            "ev_1"
          ]
        }
      },
      "facts": [],
      "ranking": {
        "reason_codes": [
          "main_service"
        ],
        "explanation": "规则引擎按关键词表选出",
        "evidence_ids": [
          "ev_1"
        ]
      },
      "risk": {
        "level": "normal",
        "domains": [],
        "reason_codes": [
          "read_only"
        ],
        "evidence_ids": [
          "ev_1"
        ]
      },
      "action": {
        "target_element_id": "el_e64c55d5",
        "target_selector": "nav > a:nth-of-type(2)",
        "target_xpath": "/html[1]/body[1]/nav[1]/a[2]",
        "kind": "navigate",
        "href": "https://demo.easyview.local/metro",
        "confirmation": null
      }
    },
    {
      "id": "card_05",
      "title": "打车",
      "subtitle": "出租网约",
      "icon": "info",
      "priority": 5,
      "intent": "learn",
      "provenance": {
        "source_element_ids": [
          "el_f31a6d95"
        ],
        "evidence": [
          {
            "id": "ev_1",
            "element_id": "el_f31a6d95",
            "field": "text",
            "quote": "出租网约"
          }
        ]
      },
      "content_meta": {
        "title": {
          "mode": "rewritten",
          "evidence_ids": [
            "ev_1"
          ]
        },
        "subtitle": {
          "mode": "rewritten",
          "evidence_ids": [
            "ev_1"
          ]
        }
      },
      "facts": [],
      "ranking": {
        "reason_codes": [
          "main_service"
        ],
        "explanation": "规则引擎按关键词表选出",
        "evidence_ids": [
          "ev_1"
        ]
      },
      "risk": {
        "level": "normal",
        "domains": [],
        "reason_codes": [
          "read_only"
        ],
        "evidence_ids": [
          "ev_1"
        ]
      },
      "action": {
        "target_element_id": "el_f31a6d95",
        "target_selector": "nav > a:nth-of-type(3)",
        "target_xpath": "/html[1]/body[1]/nav[1]/a[3]",
        "kind": "navigate",
        "href": "https://demo.easyview.local/taxi",
        "confirmation": null
      }
    },
    {
      "id": "card_06_etc",
      "title": "查ETC服务",
      "subtitle": "ETC 服务",
      "icon": "info",
      "priority": 6,
      "intent": "query",
      "provenance": {
        "source_element_ids": [
          "el_02acb258"
        ],
        "evidence": [
          {
            "id": "ev_1",
            "element_id": "el_02acb258",
            "field": "text",
            "quote": "ETC 服务"
          }
        ]
      },
      "content_meta": {
        "title": {
          "mode": "rewritten",
          "evidence_ids": [
            "ev_1"
          ]
        },
        "subtitle": {
          "mode": "rewritten",
          "evidence_ids": [
            "ev_1"
          ]
        }
      },
      "facts": [],
      "ranking": {
        "reason_codes": [
          "main_service"
        ],
        "explanation": "规则引擎按关键词表选出",
        "evidence_ids": [
          "ev_1"
        ]
      },
      "risk": {
        "level": "normal",
        "domains": [],
        "reason_codes": [
          "read_only"
        ],
        "evidence_ids": [
          "ev_1"
        ]
      },
      "action": {
        "target_element_id": "el_02acb258",
        "target_selector": "nav > a:nth-of-type(4)",
        "target_xpath": "/html[1]/body[1]/nav[1]/a[4]",
        "kind": "navigate",
        "href": "https://demo.easyview.local/etc",
        "confirmation": null
      }
    }
  ]
}